{
  "benchmark": "sle",
  "language": "sr",
  "benchmark_version": "1.0.0",
  "generated_at": "2026-07-22T00:00:00Z",
  "sponsor": "Recrewty",
  "protocol": "loglikelihood",
  "access": "open_weights",
  "ranked_tasks": [
    "arc_challenge",
    "arc_easy",
    "boolq",
    "hellaswag",
    "nq_open",
    "openbookqa",
    "piqa",
    "triviaqa",
    "winogrande"
  ],
  "task_primary_metrics": {
    "arc_challenge": "acc_norm",
    "arc_easy": "acc_norm",
    "boolq": "acc",
    "hellaswag": "acc_norm",
    "nq_open": "em",
    "openbookqa": "acc_norm",
    "piqa": "acc_norm",
    "triviaqa": "em_triviaqa",
    "winogrande": "acc"
  },
  "rows": []
}
